{
  "trans_num": "0b242abb623afc578575680df30655b9",
  "cc_num": 2703186189652095,
  "trans_date_trans_time": "2019-01-01 00:00:18",
  "unix_time": 1325376018,
  "merchant": "fraud_Rippin, Kub and Mann",
  "category": "misc_net",
  "amt": 4.97,
  "gender": "F",
  "city": "Moravian Falls",
  "state": "NC",
  "zip": "28654",
  "city_pop": 3495,
  "job": "Psychologist, counselling",
  "lat": 36.0788,
  "long": -81.1781,
  "merch_lat": 36.011293,
  "merch_long": -82.048315,
  "is_fraud": 0
}
